{
  "$schema": "https://json-schema.org/draft/2020-12/schema",
  "$id": "QK_GBFP8_HEAD64_SOURCE_ORACLE_VERIFIER_HARDENING_STATIC_V23_FRESH_L2_ACCEPTANCE_SCHEMA",
  "type": "object",
  "additionalProperties": false,
  "required": ["acceptance_sha256", "accepted", "action_id", "artifact_kind", "claim_boundary", "decision", "candidate_report_sha256", "candidate_report_file_sha256", "negative_fixture_report_sha256", "negative_fixture_report_file_sha256", "package_file_sha256", "regression_report_file_sha256", "b0_sidecar_schema_file_sha256", "b0_validator_file_sha256", "v22_action_tree_sha256", "official_payload_open_count", "official_evaluator_invocation_count", "official_target_process_starts", "reviewer_role", "static_acceptance_grants_execution_authority", "v21_or_predecessor_mutated", "v22_mutated_or_accepted", "v23_executed", "runtime_namespace_file_count"],
  "properties": {
    "acceptance_sha256": {"type": "string", "pattern": "^[0-9a-f]{64}$"},
    "accepted": {"const": true},
    "action_id": {"const": "ace2:qk-gbfp8-base-v23:source-oracle-verifier-hardening:ec58e011:additive-0001"},
    "artifact_kind": {"const": "qk_gbfp8_head64_source_oracle_verifier_hardening_static_v23_fresh_l2_acceptance"},
    "claim_boundary": {"const": "STATIC_ONLY_NO_EXECUTION_AUTHORITY"},
    "decision": {"const": "ACCEPT_STATIC_PACKAGE"},
    "candidate_report_sha256": {"type": "string", "pattern": "^[0-9a-f]{64}$"},
    "candidate_report_file_sha256": {"type": "string", "pattern": "^[0-9a-f]{64}$"},
    "negative_fixture_report_sha256": {"type": "string", "pattern": "^[0-9a-f]{64}$"},
    "negative_fixture_report_file_sha256": {"type": "string", "pattern": "^[0-9a-f]{64}$"},
    "package_file_sha256": {"type": "string", "pattern": "^[0-9a-f]{64}$"},
    "regression_report_file_sha256": {"const": "baaba1e6a305deb5467ca016b74bd953673d9664d035098a1c6284d8762795f1"},
    "b0_sidecar_schema_file_sha256": {"type": "string", "pattern": "^[0-9a-f]{64}$"},
    "b0_validator_file_sha256": {"type": "string", "pattern": "^[0-9a-f]{64}$"},
    "v22_action_tree_sha256": {"const": "7bb7ffebf39c0a5fda8d85da24e05100e8cc6674d2f72a06be1321dd5b6f4dcb"},
    "official_payload_open_count": {"const": 0},
    "official_evaluator_invocation_count": {"const": 0},
    "official_target_process_starts": {"const": 0},
    "reviewer_role": {"const": "Fresh-L2"},
    "static_acceptance_grants_execution_authority": {"const": false},
    "v21_or_predecessor_mutated": {"const": false},
    "v22_mutated_or_accepted": {"const": false},
    "v23_executed": {"const": false},
    "runtime_namespace_file_count": {"const": 0}
  }
}
