{"acceptance_sha256":"f46440f233065739aab88679543ba33fa88b67d7fc18863c619762d869bec142","accepted":true,"action_id":"ace2:qk-gbfp8-base-v23:source-oracle-verifier-hardening:ec58e011:additive-0001","artifact_kind":"qk_gbfp8_head64_source_oracle_verifier_hardening_static_v23_fresh_l2_acceptance","b0_sidecar_schema_file_sha256":"3beb5cd5ac35c66bec7ebeac8f4bd4f7a510736f1efd619f24eba82b81b1826b","b0_validator_file_sha256":"2a0786cc2ae9a9a0bb70ab5329bee61bc0d846d1a6559e3a1ee48cb69bbe1a16","candidate_report_file_sha256":"6b18251e17d6a9f7969fdefa524e9d6a9ffa47b17036db07542843dcd8154e34","candidate_report_sha256":"322309b976d65f470a834c58caf0ea71822f9403d723748d89b5b0427b5da913","claim_boundary":"STATIC_ONLY_NO_EXECUTION_AUTHORITY","decision":"ACCEPT_STATIC_PACKAGE","negative_fixture_report_file_sha256":"c1fb10082a9b863acc8e5af8b9337e25ad7cbd3234629a309ac6e4f52d1118d0","negative_fixture_report_sha256":"e13dad3cbbaf4a8eba9d8b9834fc553bf6aff91dfd7e90df9cbd6e295f1f2dc3","official_evaluator_invocation_count":0,"official_payload_open_count":0,"official_target_process_starts":0,"package_file_sha256":"6bef87e498188bc24555fe14695c33053c51e3c27ae5131a5abb6b02c12121fe","regression_report_file_sha256":"baaba1e6a305deb5467ca016b74bd953673d9664d035098a1c6284d8762795f1","reviewer_role":"Fresh-L2","runtime_namespace_file_count":0,"static_acceptance_grants_execution_authority":false,"v21_or_predecessor_mutated":false,"v22_action_tree_sha256":"7bb7ffebf39c0a5fda8d85da24e05100e8cc6674d2f72a06be1321dd5b6f4dcb","v22_mutated_or_accepted":false,"v23_executed":false}
